{"schema_version":3,"run_id":"run_c19c469d331b4054","status":"blocked","outcome":null,"summary":"provider_incident_blocked: src_https-github-com-anthropics-skills-anthropic-agent-skills_04f79b56: 403: 403 Forbidden (provider-level) (403)","total_actions":0,"errors":1,"warnings":0,"last_phase_event_digest":"sha256:3c036cfaaec00fe100cbe73ed2d4dc2901f2a60bd2b7f8e3ce2e4f5fdea90fd1","terminal_digest":"sha256:c86b53589ffbf7087de8f236d361c17bd4defd6f540ff371cb5569e69cccc777"}