{"schema_version":3,"run_id":"run_ab1ac3aeb6a84e86","status":"interrupted","outcome":null,"summary":"Target execution interrupted","total_actions":0,"errors":1,"warnings":0,"last_phase_event_digest":"sha256:73591aa600ab2263235ce778af6f293483c0c680160b4c8d5eca29bf732c0fe1","terminal_digest":"sha256:704e4822ccdc9506fab26e00c1f07b6c50d34142a64db30dfd0a681317a83cd4"}