{"schema_version":3,"run_id":"run_6a603cef5210474c","status":"blocked","outcome":null,"summary":"provider_incident_blocked: src_https-github-com-anthropics-skills-anthropic-agent-skills_04f79b56: 403: 403 Forbidden (provider-level) (403)","total_actions":0,"errors":1,"warnings":0,"last_phase_event_digest":"sha256:238566a9a897aba8dc905c2a057f8675f6ad44793aa5125cdc76ee453c05807e","terminal_digest":"sha256:c3108577169350cb742d8a33b481aa00fa72395208a1f3caee1d6f16940ac976"}