{"schema_version":3,"run_id":"run_cf9d5562a9fc4634","status":"insufficient_evidence","outcome":"insufficient_evidence","summary":"Run completed with gaps. Exhaustion proof: gap_exists. new_artifacts, active_intents, funnel require further processing.","total_actions":9,"errors":0,"warnings":0,"last_phase_event_digest":"sha256:2591b6a560aebc572169c0530029a688431279043a5fe425e1ca381cb69c0766","terminal_digest":"sha256:aba5ac896c1ad88e31ee687babe02251c418330bd5792ba417babd1c4f4466ba"}