{"schema_version":3,"run_id":"run_eba2cf52c61d45c7","status":"blocked","outcome":null,"summary":"provider_incident_blocked: src_https-github-com-anthropics-skills-anthropic-agent-skills_04f79b56: 403: 403 Forbidden (provider-level) (403)","total_actions":0,"errors":1,"warnings":0,"last_phase_event_digest":"sha256:d571e092361c73c1943d797adb2781bcce40a2bca4d82270232639e1fdfc2a24","terminal_digest":"sha256:4f83d63558762e258f0dc4431d7bb9a517813faffaf15d4592c1239a1f168593"}